experiments/runs/models/models.csv
model_name,candidate_rank,candidate_config,num_layers,batch,input_features,output_features,layer_shapes,layer_parallelism,tile_m,tile_k,tile_n,build_threads,width_budget,width_used,width_slack,max_rows_per_layer,sum_cas_length,sum_parallel_factor,bottleneck_tile_workload,workload_imbalance,total_padding_waste,bn_handling,reference_kind,latency_ns,latency_us,throughput_batches_per_s,throughput_vectors_per_s,gops_per_s,output_ok,max_abs_error,status,error,active_core_count,active_column_count,active_row_count,min_active_col,max_active_col,min_active_row,max_active_row,active_col_span,active_row_span,column_band_count,row_band_count,uses_multiple_rows,uses_multiple_column_bands,output_dir
jet_tagger,0,cand_00_cols_12_wl_256_L0_PK_1_PN_4_L1_PK_4_PN_2_L2_PK_2_PN_2_L3_PK_2_PN_1,4,8,16,8,16x64|64x32|32x32|32x8,1x4|4x2|2x2|2x1,4,8,8,32,31,12,19,4,9,18,256,0,256,batchnorm_folded_into_dense_weights_and_bias,hls_bit_exact,727.2,0.7272000000000001,1375137.513751375,11001100.110011,95.75357535753575,True,0.0,success,,18,8,4,7,16,0,3,10,4,9,1,True,True,/home/a.gnaneswaran/fpl26/aie4ml/experiments/runs/models/jet_tagger/cand_00_cols_12_wl_256_L0_PK_1_PN_4_L1_PK_4_PN_2_L2_PK_2_PN_2_L3_PK_2_PN_1
jet_tagger,1,cand_01_cols_11_wl_512_L0_PK_1_PN_2_L1_PK_4_PN_1_L2_PK_2_PN_1_L3_PK_1_PN_1,4,8,16,8,16x64|64x32|32x32|32x8,1x2|4x1|2x1|1x1,4,8,8,32,31,11,20,2,8,9,512,0,256,batchnorm_folded_into_dense_weights_and_bias,hls_bit_exact,832.0,0.832,1201923.076923077,9615384.615384616,83.6923076923077,True,0.0,success,,9,5,3,7,11,0,2,5,3,5,1,True,True,/home/a.gnaneswaran/fpl26/aie4ml/experiments/runs/models/jet_tagger/cand_01_cols_11_wl_512_L0_PK_1_PN_2_L1_PK_4_PN_1_L2_PK_2_PN_1_L3_PK_1_PN_1
jet_tagger,2,cand_02_cols_10_wl_512_L0_PK_1_PN_2_L1_PK_4_PN_1_L2_PK_1_PN_2_L3_PK_1_PN_1,4,8,16,8,16x64|64x32|32x32|32x8,1x2|4x1|1x2|1x1,4,8,8,32,31,10,21,2,7,9,512,0,256,batchnorm_folded_into_dense_weights_and_bias,hls_bit_exact,821.6,0.8216,1217137.29308666,9737098.34469328,84.75170399221032,True,0.0,success,,9,4,3,7,10,0,2,4,3,5,1,True,True,/home/a.gnaneswaran/fpl26/aie4ml/experiments/runs/models/jet_tagger/cand_02_cols_10_wl_512_L0_PK_1_PN_2_L1_PK_4_PN_1_L2_PK_1_PN_2_L3_PK_1_PN_1
jet_tagger,3,cand_03_cols_9_wl_512_L0_PK_1_PN_2_L1_PK_2_PN_2_L2_PK_2_PN_1_L3_PK_1_PN_1,4,8,16,8,16x64|64x32|32x32|32x8,1x2|2x2|2x1|1x1,4,8,8,32,31,9,22,2,6,9,512,0,256,batchnorm_folded_into_dense_weights_and_bias,hls_bit_exact,804.8,0.8048,1242544.731610338,9940357.852882704,86.52087475149106,True,0.0,success,,9,4,4,7,10,0,3,4,4,6,1,True,True,/home/a.gnaneswaran/fpl26/aie4ml/experiments/runs/models/jet_tagger/cand_03_cols_9_wl_512_L0_PK_1_PN_2_L1_PK_2_PN_2_L2_PK_2_PN_1_L3_PK_1_PN_1
jet_tagger,4,cand_04_cols_8_wl_512_L0_PK_1_PN_2_L1_PK_2_PN_2_L2_PK_1_PN_2_L3_PK_1_PN_1,4,8,16,8,16x64|64x32|32x32|32x8,1x2|2x2|1x2|1x1,4,8,8,32,31,8,23,2,5,9,512,0,256,batchnorm_folded_into_dense_weights_and_bias,hls_bit_exact,811.2,0.8112,1232741.6173570019,9861932.938856015,85.83826429980276,True,0.0,success,,9,4,3,7,12,0,2,6,3,7,1,True,True,/home/a.gnaneswaran/fpl26/aie4ml/experiments/runs/models/jet_tagger/cand_04_cols_8_wl_512_L0_PK_1_PN_2_L1_PK_2_PN_2_L2_PK_1_PN_2_L3_PK_1_PN_1
jet_tagger,37,cand_37_cols_7_wl_1024_L0_PK_1_PN_1_L1_PK_1_PN_2_L2_PK_1_PN_1_L3_PK_1_PN_1,4,8,16,8,16x64|64x32|32x32|32x8,1x1|1x2|1x1|1x1,4,8,8,32,31,7,24,2,4,5,1024,512,256,batchnorm_folded_into_dense_weights_and_bias,hls_bit_exact,960.0,0.96,1041666.6666666666,8333333.333333333,72.53333333333333,True,0.0,success,,5,2,3,7,9,0,2,3,3,5,1,True,True,/home/a.gnaneswaran/fpl26/aie4ml/experiments/runs/models/jet_tagger/cand_37_cols_7_wl_1024_L0_PK_1_PN_1_L1_PK_1_PN_2_L2_PK_1_PN_1_L3_PK_1_PN_1
jet_tagger,36,cand_36_cols_8_wl_1024_L0_PK_1_PN_1_L1_PK_2_PN_1_L2_PK_1_PN_1_L3_PK_1_PN_1,4,8,16,8,16x64|64x32|32x32|32x8,1x1|2x1|1x1|1x1,4,8,8,32,31,8,23,1,5,5,1024,512,256,batchnorm_folded_into_dense_weights_and_bias,hls_bit_exact,993.6,0.9936,1006441.2238325281,8051529.790660225,70.0805152979066,True,0.0,success,,5,4,2,7,10,0,1,4,2,3,1,True,True,/home/a.gnaneswaran/fpl26/aie4ml/experiments/runs/models/jet_tagger/cand_36_cols_8_wl_1024_L0_PK_1_PN_1_L1_PK_2_PN_1_L2_PK_1_PN_1_L3_PK_1_PN_1
jet_tagger,5,cand_05_cols_12_wl_512_L0_PK_1_PN_2_L1_PK_4_PN_1_L2_PK_2_PN_1_L3_PK_2_PN_1,4,8,16,8,16x64|64x32|32x32|32x8,1x2|4x1|2x1|2x1,4,8,8,32,31,12,19,2,9,10,512,256,256,batchnorm_folded_into_dense_weights_and_bias,hls_bit_exact,803.2,0.8032,1245019.920318725,9960159.3625498,86.69322709163346,True,0.0,success,,10,6,3,7,12,0,2,6,3,5,1,True,True,/home/a.gnaneswaran/fpl26/aie4ml/experiments/runs/models/jet_tagger/cand_05_cols_12_wl_512_L0_PK_1_PN_2_L1_PK_4_PN_1_L2_PK_2_PN_1_L3_PK_2_PN_1
jet_tagger,6,cand_06_cols_11_wl_512_L0_PK_1_PN_2_L1_PK_4_PN_2_L2_PK_2_PN_1_L3_PK_1_PN_1,4,8,16,8,16x64|64x32|32x32|32x8,1x2|4x2|2x1|1x1,4,8,8,32,31,11,20,2,8,13,512,256,256,batchnorm_folded_into_dense_weights_and_bias,hls_bit_exact,805.6,0.8056,1241310.8242303873,9930486.593843099,86.43495531281033,True,0.0,success,,13,5,4,7,11,0,3,5,4,6,1,True,True,/home/a.gnaneswaran/fpl26/aie4ml/experiments/runs/models/jet_tagger/cand_06_cols_11_wl_512_L0_PK_1_PN_2_L1_PK_4_PN_2_L2_PK_2_PN_1_L3_PK_1_PN_1
jet_tagger,7,cand_07_cols_11_wl_512_L0_PK_1_PN_2_L1_PK_4_PN_1_L2_PK_2_PN_2_L3_PK_1_PN_1,4,8,16,8,16x64|64x32|32x32|32x8,1x2|4x1|2x2|1x1,4,8,8,32,31,11,20,2,8,11,512,256,256,batchnorm_folded_into_dense_weights_and_bias,hls_bit_exact,788.0,0.788,1269035.5329949239,10152284.263959391,88.36548223350253,True,0.0,success,,11,7,3,7,14,0,2,8,3,6,1,True,True,/home/a.gnaneswaran/fpl26/aie4ml/experiments/runs/models/jet_tagger/cand_07_cols_11_wl_512_L0_PK_1_PN_2_L1_PK_4_PN_1_L2_PK_2_PN_2_L3_PK_1_PN_1
jet_tagger,17,cand_17_cols_12_wl_512_L0_PK_1_PN_2_L1_PK_4_PN_2_L2_PK_2_PN_1_L3_PK_2_PN_1,4,8,16,8,16x64|64x32|32x32|32x8,1x2|4x2|2x1|2x1,4,8,8,32,31,12,19,2,9,14,512,512,256,batchnorm_folded_into_dense_weights_and_bias,hls_bit_exact,762.4,0.7624,1311647.4291710388,10493179.43336831,91.33263378803778,True,0.0,success,,14,6,4,7,12,0,3,6,4,6,1,True,True,/home/a.gnaneswaran/fpl26/aie4ml/experiments/runs/models/jet_tagger/cand_17_cols_12_wl_512_L0_PK_1_PN_2_L1_PK_4_PN_2_L2_PK_2_PN_1_L3_PK_2_PN_1
jet_tagger,18,cand_18_cols_12_wl_512_L0_PK_1_PN_2_L1_PK_4_PN_1_L2_PK_2_PN_2_L3_PK_2_PN_1,4,8,16,8,16x64|64x32|32x32|32x8,1x2|4x1|2x2|2x1,4,8,8,32,31,12,19,2,9,12,512,512,256,batchnorm_folded_into_dense_weights_and_bias,hls_bit_exact,761.6,0.7616,1313025.2100840337,10504201.68067227,91.42857142857143,True,0.0,success,,12,8,3,7,15,0,2,9,3,6,1,True,True,/home/a.gnaneswaran/fpl26/aie4ml/experiments/runs/models/jet_tagger/cand_18_cols_12_wl_512_L0_PK_1_PN_2_L1_PK_4_PN_1_L2_PK_2_PN_2_L3_PK_2_PN_1
vae_lhc_medium,0,cand_00_cols_22_wl_256_L0_PK_4_PN_4_L1_PK_4_PN_2_L2_PK_2_PN_1_L3_PK_1_PN_2_L4_PK_2_PN_4_L5_PK_4_PN_4,6,8,64,64,64x64|64x32|32x8|8x32|32x64|64x64,4x4|4x2|2x1|1x2|2x4|4x4,4,8,8,32,31,22,9,4,17,52,256,0,512,no_batchnorm_layers,hls_bit_exact,1151.2,1.1512,868658.7908269631,6949270.326615705,177.90132036136205,True,0.0,success,,52,16,4,7,26,0,3,20,4,17,1,True,True,/home/a.gnaneswaran/fpl26/aie4ml/experiments/runs/models/vae_lhc_medium/cand_00_cols_22_wl_256_L0_PK_4_PN_4_L1_PK_4_PN_2_L2_PK_2_PN_1_L3_PK_1_PN_2_L4_PK_2_PN_4_L5_PK_4_PN_4
vae_lhc_medium,1,cand_01_cols_21_wl_512_L0_PK_4_PN_2_L1_PK_4_PN_1_L2_PK_1_PN_1_L3_PK_1_PN_1_L4_PK_2_PN_2_L5_PK_4_PN_2,6,8,64,64,64x64|64x32|32x8|8x32|32x64|64x64,4x2|4x1|1x1|1x1|2x2|4x2,4,8,8,32,31,21,10,2,16,26,512,0,512,no_batchnorm_layers,hls_bit_exact,1302.4,1.3024,767813.2678132678,6142506.142506142,157.24815724815724,True,0.0,success,,26,13,3,7,21,0,2,15,3,9,1,True,True,/home/a.gnaneswaran/fpl26/aie4ml/experiments/runs/models/vae_lhc_medium/cand_01_cols_21_wl_512_L0_PK_4_PN_2_L1_PK_4_PN_1_L2_PK_1_PN_1_L3_PK_1_PN_1_L4_PK_2_PN_2_L5_PK_4_PN_2
vae_lhc_medium,2,cand_02_cols_20_wl_512_L0_PK_4_PN_2_L1_PK_4_PN_1_L2_PK_1_PN_1_L3_PK_1_PN_1_L4_PK_1_PN_4_L5_PK_4_PN_2,6,8,64,64,64x64|64x32|32x8|8x32|32x64|64x64,4x2|4x1|1x1|1x1|1x4|4x2,4,8,8,32,31,20,11,4,15,26,512,0,512,no_batchnorm_layers,hls_bit_exact,1290.4,1.2904,774953.5027898325,6199628.02231866,158.7104773713577,True,0.0,success,,26,12,5,7,20,0,4,14,5,11,1,True,True,/home/a.gnaneswaran/fpl26/aie4ml/experiments/runs/models/vae_lhc_medium/cand_02_cols_20_wl_512_L0_PK_4_PN_2_L1_PK_4_PN_1_L2_PK_1_PN_1_L3_PK_1_PN_1_L4_PK_1_PN_4_L5_PK_4_PN_2
vae_lhc_medium,3,cand_03_cols_19_wl_512_L0_PK_4_PN_2_L1_PK_2_PN_2_L2_PK_1_PN_1_L3_PK_1_PN_1_L4_PK_2_PN_2_L5_PK_4_PN_2,6,8,64,64,64x64|64x32|32x8|8x32|32x64|64x64,4x2|2x2|1x1|1x1|2x2|4x2,4,8,8,32,31,19,12,2,14,26,512,0,512,no_batchnorm_layers,hls_bit_exact,1280.8,1.2808,780762.0237351656,6246096.189881325,159.9000624609619,True,0.0,success,,26,11,4,7,17,0,3,11,4,10,1,True,True,/home/a.gnaneswaran/fpl26/aie4ml/experiments/runs/models/vae_lhc_medium/cand_03_cols_19_wl_512_L0_PK_4_PN_2_L1_PK_2_PN_2_L2_PK_1_PN_1_L3_PK_1_PN_1_L4_PK_2_PN_2_L5_PK_4_PN_2
vae_lhc_medium,6,cand_06_cols_18_wl_512_L0_PK_4_PN_2_L1_PK_4_PN_1_L2_PK_1_PN_1_L3_PK_1_PN_1_L4_PK_1_PN_4_L5_PK_2_PN_4,6,8,64,64,64x64|64x32|32x8|8x32|32x64|64x64,4x2|4x1|1x1|1x1|1x4|2x4,4,8,8,32,31,18,13,4,13,26,512,0,512,no_batchnorm_layers,hls_bit_exact,1292.0,1.292,773993.8080495356,6191950.464396285,158.5139318885449,True,0.0,success,,26,10,5,7,18,0,4,12,5,13,1,True,True,/home/a.gnaneswaran/fpl26/aie4ml/experiments/runs/models/vae_lhc_medium/cand_06_cols_18_wl_512_L0_PK_4_PN_2_L1_PK_4_PN_1_L2_PK_1_PN_1_L3_PK_1_PN_1_L4_PK_1_PN_4_L5_PK_2_PN_4
vae_lhc_medium,9,cand_09_cols_17_wl_512_L0_PK_4_PN_2_L1_PK_2_PN_2_L2_PK_1_PN_1_L3_PK_1_PN_1_L4_PK_2_PN_2_L5_PK_2_PN_4,6,8,64,64,64x64|64x32|32x8|8x32|32x64|64x64,4x2|2x2|1x1|1x1|2x2|2x4,4,8,8,32,31,17,14,4,12,26,512,0,512,no_batchnorm_layers,hls_bit_exact,1276.0,1.276,783699.0595611285,6269592.476489028,160.50156739811914,True,0.0,success,,26,10,4,7,19,0,3,13,4,12,1,True,True,/home/a.gnaneswaran/fpl26/aie4ml/experiments/runs/models/vae_lhc_medium/cand_09_cols_17_wl_512_L0_PK_4_PN_2_L1_PK_2_PN_2_L2_PK_1_PN_1_L3_PK_1_PN_1_L4_PK_2_PN_2_L5_PK_2_PN_4
vae_lhc_medium,12,cand_12_cols_16_wl_512_L0_PK_4_PN_2_L1_PK_2_PN_2_L2_PK_1_PN_1_L3_PK_1_PN_1_L4_PK_1_PN_4_L5_PK_2_PN_4,6,8,64,64,64x64|64x32|32x8|8x32|32x64|64x64,4x2|2x2|1x1|1x1|1x4|2x4,4,8,8,32,31,16,15,4,11,26,512,0,512,no_batchnorm_layers,hls_bit_exact,1281.6,1.2815999999999999,780274.6566791511,6242197.253433209,159.80024968789016,True,0.0,success,,26,9,5,7,18,0,4,12,5,14,1,True,True,/home/a.gnaneswaran/fpl26/aie4ml/experiments/runs/models/vae_lhc_medium/cand_12_cols_16_wl_512_L0_PK_4_PN_2_L1_PK_2_PN_2_L2_PK_1_PN_1_L3_PK_1_PN_1_L4_PK_1_PN_4_L5_PK_2_PN_4
vae_lhc_medium,15,cand_15_cols_15_wl_512_L0_PK_2_PN_4_L1_PK_2_PN_2_L2_PK_1_PN_1_L3_PK_1_PN_1_L4_PK_2_PN_2_L5_PK_2_PN_4,6,8,64,64,64x64|64x32|32x8|8x32|32x64|64x64,2x4|2x2|1x1|1x1|2x2|2x4,4,8,8,32,31,15,16,4,10,26,512,0,512,no_batchnorm_layers,hls_bit_exact,1263.2,1.2632,791640.278657378,6333122.229259024,162.12792906903104,True,0.0,success,,26,8,4,7,17,0,3,11,4,14,1,True,True,/home/a.gnaneswaran/fpl26/aie4ml/experiments/runs/models/vae_lhc_medium/cand_15_cols_15_wl_512_L0_PK_2_PN_4_L1_PK_2_PN_2_L2_PK_1_PN_1_L3_PK_1_PN_1_L4_PK_2_PN_2_L5_PK_2_PN_4
vae_lhc_medium,16,cand_16_cols_14_wl_512_L0_PK_2_PN_4_L1_PK_2_PN_2_L2_PK_1_PN_1_L3_PK_1_PN_1_L4_PK_1_PN_4_L5_PK_2_PN_4,6,8,64,64,64x64|64x32|32x8|8x32|32x64|64x64,2x4|2x2|1x1|1x1|1x4|2x4,4,8,8,32,31,14,17,4,9,26,512,0,512,no_batchnorm_layers,hls_bit_exact,1286.4,1.2864,777363.1840796019,6218905.472636815,159.20398009950247,True,0.0,success,,26,7,5,7,16,0,4,10,5,16,1,True,True,/home/a.gnaneswaran/fpl26/aie4ml/experiments/runs/models/vae_lhc_medium/cand_16_cols_14_wl_512_L0_PK_2_PN_4_L1_PK_2_PN_2_L2_PK_1_PN_1_L3_PK_1_PN_1_L4_PK_1_PN_4_L5_PK_2_PN_4
vae_lhc_medium,17,cand_17_cols_22_wl_512_L0_PK_4_PN_2_L1_PK_4_PN_1_L2_PK_2_PN_1_L3_PK_1_PN_1_L4_PK_2_PN_2_L5_PK_4_PN_2,6,8,64,64,64x64|64x32|32x8|8x32|32x64|64x64,4x2|4x1|2x1|1x1|2x2|4x2,4,8,8,32,31,22,9,2,17,27,512,256,512,no_batchnorm_layers,hls_bit_exact,1278.4,1.2784,782227.7847309136,6257822.277847309,160.20025031289111,True,0.0,success,,27,13,4,7,19,0,3,13,4,9,1,True,True,/home/a.gnaneswaran/fpl26/aie4ml/experiments/runs/models/vae_lhc_medium/cand_17_cols_22_wl_512_L0_PK_4_PN_2_L1_PK_4_PN_1_L2_PK_2_PN_1_L3_PK_1_PN_1_L4_PK_2_PN_2_L5_PK_4_PN_2
vae_lhc_medium,18,cand_18_cols_21_wl_512_L0_PK_4_PN_2_L1_PK_4_PN_2_L2_PK_1_PN_1_L3_PK_1_PN_1_L4_PK_2_PN_2_L5_PK_4_PN_2,6,8,64,64,64x64|64x32|32x8|8x32|32x64|64x64,4x2|4x2|1x1|1x1|2x2|4x2,4,8,8,32,31,21,10,2,16,30,512,256,512,no_batchnorm_layers,hls_bit_exact,1254.4,1.2544000000000002,797193.8775510204,6377551.020408163,163.26530612244898,True,0.0,success,,30,13,4,7,21,0,3,15,4,10,1,True,True,/home/a.gnaneswaran/fpl26/aie4ml/experiments/runs/models/vae_lhc_medium/cand_18_cols_21_wl_512_L0_PK_4_PN_2_L1_PK_4_PN_2_L2_PK_1_PN_1_L3_PK_1_PN_1_L4_PK_2_PN_2_L5_PK_4_PN_2
vae_lhc_medium,20,cand_20_cols_21_wl_512_L0_PK_4_PN_2_L1_PK_4_PN_1_L2_PK_1_PN_1_L3_PK_1_PN_1_L4_PK_2_PN_2_L5_PK_4_PN_4,6,8,64,64,64x64|64x32|32x8|8x32|32x64|64x64,4x2|4x1|1x1|1x1|2x2|4x4,4,8,8,32,31,21,10,4,16,34,512,256,512,no_batchnorm_layers,hls_bit_exact,1286.4,1.2864,777363.1840796019,6218905.472636815,159.20398009950247,True,0.0,success,,34,13,4,7,21,0,3,15,4,11,1,True,True,/home/a.gnaneswaran/fpl26/aie4ml/experiments/runs/models/vae_lhc_medium/cand_20_cols_21_wl_512_L0_PK_4_PN_2_L1_PK_4_PN_1_L2_PK_1_PN_1_L3_PK_1_PN_1_L4_PK_2_PN_2_L5_PK_4_PN_4
tau_event_selection,0,cand_00_cols_18_wl_512_L0_PK_5_PN_4_L1_PK_4_PN_2_L2_PK_4_PN_2_L3_PK_2_PN_1,4,8,160,8,160x64|64x64|64x64|64x8,5x4|4x2|4x2|2x1,4,8,8,32,31,18,13,4,15,38,512,0,512,no_batchnorm_layers,hls_bit_exact,1004.8,1.0048,995222.9299363057,7961783.439490446,301.656050955414,True,0.0,success,,38,13,4,7,20,0,3,14,4,9,1,True,True,/home/a.gnaneswaran/fpl26/aie4ml/experiments/runs/models/tau_event_selection/cand_00_cols_18_wl_512_L0_PK_5_PN_4_L1_PK_4_PN_2_L2_PK_4_PN_2_L3_PK_2_PN_1
tau_event_selection,1,cand_01_cols_16_wl_512_L0_PK_5_PN_4_L1_PK_4_PN_2_L2_PK_2_PN_4_L3_PK_2_PN_1,4,8,160,8,160x64|64x64|64x64|64x8,5x4|4x2|2x4|2x1,4,8,8,32,31,16,15,4,13,38,512,0,512,no_batchnorm_layers,hls_bit_exact,1001.6,1.0016,998402.5559105431,7987220.447284345,302.6198083067093,True,0.0,success,,38,12,5,7,20,0,4,14,5,11,1,True,True,/home/a.gnaneswaran/fpl26/aie4ml/experiments/runs/models/tau_event_selection/cand_01_cols_16_wl_512_L0_PK_5_PN_4_L1_PK_4_PN_2_L2_PK_2_PN_4_L3_PK_2_PN_1
tau_event_selection,3,cand_03_cols_14_wl_512_L0_PK_5_PN_4_L1_PK_2_PN_4_L2_PK_2_PN_4_L3_PK_2_PN_1,4,8,160,8,160x64|64x64|64x64|64x8,5x4|2x4|2x4|2x1,4,8,8,32,31,14,17,4,11,38,512,0,512,no_batchnorm_layers,hls_bit_exact,992.8,0.9927999999999999,1007252.2159548751,8058017.727639001,305.3021756647865,True,0.0,success,,38,10,5,7,18,0,4,12,5,13,1,True,True,/home/a.gnaneswaran/fpl26/aie4ml/experiments/runs/models/tau_event_selection/cand_03_cols_14_wl_512_L0_PK_5_PN_4_L1_PK_2_PN_4_L2_PK_2_PN_4_L3_PK_2_PN_1
tau_event_selection,4,cand_04_cols_20_wl_512_L0_PK_5_PN_4_L1_PK_4_PN_2_L2_PK_4_PN_2_L3_PK_4_PN_1,4,8,160,8,160x64|64x64|64x64|64x8,5x4|4x2|4x2|4x1,4,8,8,32,31,20,11,4,17,40,512,256,512,no_batchnorm_layers,hls_bit_exact,1000.8,1.0008,999200.6394884093,7993605.115907274,302.8617106314948,True,0.0,success,,40,15,4,7,22,0,3,16,4,9,1,True,True,/home/a.gnaneswaran/fpl26/aie4ml/experiments/runs/models/tau_event_selection/cand_04_cols_20_wl_512_L0_PK_5_PN_4_L1_PK_4_PN_2_L2_PK_4_PN_2_L3_PK_4_PN_1
tau_event_selection,18,cand_18_cols_17_wl_768_L0_PK_4_PN_4_L1_PK_4_PN_2_L2_PK_4_PN_2_L3_PK_2_PN_1,4,8,160,8,160x64|64x64|64x64|64x8,4x4|4x2|4x2|2x1,4,8,8,32,31,17,14,4,14,34,768,768,2560,no_batchnorm_layers,hls_bit_exact,1048.8,1.0488,953470.6331045005,7627765.064836004,289.0007627765065,False,0.046875,failed,output mismatch: max_abs_error=0.046875,34,12,4,7,19,0,3,13,4,9,1,True,True,/home/a.gnaneswaran/fpl26/aie4ml/experiments/runs/models/tau_event_selection/cand_18_cols_17_wl_768_L0_PK_4_PN_4_L1_PK_4_PN_2_L2_PK_4_PN_2_L3_PK_2_PN_1
tau_event_selection,19,cand_19_cols_15_wl_768_L0_PK_4_PN_4_L1_PK_4_PN_2_L2_PK_2_PN_4_L3_PK_2_PN_1,4,8,160,8,160x64|64x64|64x64|64x8,4x4|4x2|2x4|2x1,4,8,8,32,31,15,16,4,12,34,768,768,2560,no_batchnorm_layers,hls_bit_exact,1040.0,1.04,961538.4615384615,7692307.692307692,291.44615384615383,False,0.046875,failed,output mismatch: max_abs_error=0.046875,34,11,5,7,19,0,4,13,5,11,1,True,True,/home/a.gnaneswaran/fpl26/aie4ml/experiments/runs/models/tau_event_selection/cand_19_cols_15_wl_768_L0_PK_4_PN_4_L1_PK_4_PN_2_L2_PK_2_PN_4_L3_PK_2_PN_1
tau_event_selection,21,cand_21_cols_13_wl_768_L0_PK_4_PN_4_L1_PK_2_PN_4_L2_PK_2_PN_4_L3_PK_2_PN_1,4,8,160,8,160x64|64x64|64x64|64x8,4x4|2x4|2x4|2x1,4,8,8,32,31,13,18,4,10,34,768,768,2560,no_batchnorm_layers,hls_bit_exact,1016.0,1.016,984251.968503937,7874015.748031496,298.3307086614173,False,0.046875,failed,output mismatch: max_abs_error=0.046875,34,9,5,7,17,0,4,11,5,13,1,True,True,/home/a.gnaneswaran/fpl26/aie4ml/experiments/runs/models/tau_event_selection/cand_21_cols_13_wl_768_L0_PK_4_PN_4_L1_PK_2_PN_4_L2_PK_2_PN_4_L3_PK_2_PN_1
tau_event_selection,22,cand_22_cols_19_wl_768_L0_PK_4_PN_4_L1_PK_4_PN_2_L2_PK_4_PN_2_L3_PK_4_PN_1,4,8,160,8,160x64|64x64|64x64|64x8,4x4|4x2|4x2|4x1,4,8,8,32,31,19,12,4,16,36,768,1024,2560,no_batchnorm_layers,hls_bit_exact,1035.2,1.0352000000000001,965996.9088098918,7727975.270479134,292.79752704791343,False,0.046875,failed,output mismatch: max_abs_error=0.046875,36,14,4,7,21,0,3,15,4,9,1,True,True,/home/a.gnaneswaran/fpl26/aie4ml/experiments/runs/models/tau_event_selection/cand_22_cols_19_wl_768_L0_PK_4_PN_4_L1_PK_4_PN_2_L2_PK_4_PN_2_L3_PK_4_PN_1
tau_event_selection,42,cand_42_cols_12_wl_1024_L0_PK_5_PN_2_L1_PK_2_PN_2_L2_PK_1_PN_4_L3_PK_1_PN_1,4,8,160,8,160x64|64x64|64x64|64x8,5x2|2x2|1x4|1x1,4,8,8,32,31,12,19,4,9,19,1024,0,512,no_batchnorm_layers,hls_bit_exact,1224.0,1.224,816993.4640522876,6535947.712418301,247.63398692810458,True,0.0,success,,19,8,5,7,16,0,4,10,5,9,1,True,True,/home/a.gnaneswaran/fpl26/aie4ml/experiments/runs/models/tau_event_selection/cand_42_cols_12_wl_1024_L0_PK_5_PN_2_L1_PK_2_PN_2_L2_PK_1_PN_4_L3_PK_1_PN_1
tau_event_selection,44,cand_44_cols_11_wl_1024_L0_PK_5_PN_2_L1_PK_1_PN_4_L2_PK_1_PN_4_L3_PK_1_PN_1,4,8,160,8,160x64|64x64|64x64|64x8,5x2|1x4|1x4|1x1,4,8,8,32,31,11,20,4,8,19,1024,0,512,no_batchnorm_layers,hls_bit_exact,1243.2,1.2432,804375.8043758044,6435006.435006435,243.8095238095238,True,0.0,success,,19,7,5,7,15,0,4,9,5,11,1,True,True,/home/a.gnaneswaran/fpl26/aie4ml/experiments/runs/models/tau_event_selection/cand_44_cols_11_wl_1024_L0_PK_5_PN_2_L1_PK_1_PN_4_L2_PK_1_PN_4_L3_PK_1_PN_1
tau_event_selection,53,cand_53_cols_10_wl_1024_L0_PK_4_PN_4_L1_PK_1_PN_4_L2_PK_1_PN_4_L3_PK_1_PN_1,4,8,160,8,160x64|64x64|64x64|64x8,4x4|1x4|1x4|1x1,4,8,8,32,31,10,21,4,7,25,1024,256,2560,no_batchnorm_layers,hls_bit_exact,1204.0,1.204,830564.7840531562,6644518.272425249,251.74750830564784,False,0.046875,failed,output mismatch: max_abs_error=0.046875,25,6,5,7,14,0,4,8,5,13,1,True,True,/home/a.gnaneswaran/fpl26/aie4ml/experiments/runs/models/tau_event_selection/cand_53_cols_10_wl_1024_L0_PK_4_PN_4_L1_PK_1_PN_4_L2_PK_1_PN_4_L3_PK_1_PN_1
tau_event_selection,36,cand_36_cols_17_wl_1024_L0_PK_5_PN_2_L1_PK_4_PN_1_L2_PK_4_PN_1_L3_PK_1_PN_1,4,8,160,8,160x64|64x64|64x64|64x8,5x2|4x1|4x1|1x1,4,8,8,32,31,17,14,2,14,19,1024,0,512,no_batchnorm_layers,hls_bit_exact,1276.0,1.276,783699.0595611285,6269592.476489028,237.5423197492163,True,0.0,success,,19,12,2,7,19,0,1,13,2,5,1,True,True,/home/a.gnaneswaran/fpl26/aie4ml/experiments/runs/models/tau_event_selection/cand_36_cols_17_wl_1024_L0_PK_5_PN_2_L1_PK_4_PN_1_L2_PK_4_PN_1_L3_PK_1_PN_1
vae_lhc_large,0,cand_00_cols_30_wl_512_L0_PK_4_PN_4_L1_PK_8_PN_2_L2_PK_2_PN_1_L3_PK_1_PN_2_L4_PK_2_PN_8_L5_PK_8_PN_2,6,8,64,64,64x128|128x64|64x12|12x64|64x128|128x64,4x4|8x2|2x1|1x2|2x8|8x2,4,8,8,32,31,30,1,8,25,68,512,0,512,no_batchnorm_layers,hls_bit_exact,1522.4,1.5224000000000002,656857.5932737782,5254860.746190226,360.525486074619,True,0.0,success,,68,24,8,7,34,0,7,28,8,19,1,True,True,/home/a.gnaneswaran/fpl26/aie4ml/experiments/runs/models/vae_lhc_large/cand_00_cols_30_wl_512_L0_PK_4_PN_4_L1_PK_8_PN_2_L2_PK_2_PN_1_L3_PK_1_PN_2_L4_PK_2_PN_8_L5_PK_8_PN_2
vae_lhc_large,2,cand_02_cols_28_wl_512_L0_PK_4_PN_4_L1_PK_8_PN_2_L2_PK_2_PN_1_L3_PK_1_PN_2_L4_PK_4_PN_4_L5_PK_4_PN_4,6,8,64,64,64x128|128x64|64x12|12x64|64x128|128x64,4x4|8x2|2x1|1x2|4x4|4x4,4,8,8,32,31,28,3,4,23,68,512,0,512,no_batchnorm_layers,hls_bit_exact,1500.8,1.5008,666311.3006396588,5330490.405117271,365.7142857142857,True,0.0,success,,68,22,4,7,32,0,3,26,4,17,1,True,True,/home/a.gnaneswaran/fpl26/aie4ml/experiments/runs/models/vae_lhc_large/cand_02_cols_28_wl_512_L0_PK_4_PN_4_L1_PK_8_PN_2_L2_PK_2_PN_1_L3_PK_1_PN_2_L4_PK_4_PN_4_L5_PK_4_PN_4
vae_lhc_large,5,cand_05_cols_26_wl_512_L0_PK_4_PN_4_L1_PK_8_PN_2_L2_PK_2_PN_1_L3_PK_1_PN_2_L4_PK_2_PN_8_L5_PK_4_PN_4,6,8,64,64,64x128|128x64|64x12|12x64|64x128|128x64,4x4|8x2|2x1|1x2|2x8|4x4,4,8,8,32,31,26,5,8,21,68,512,0,512,no_batchnorm_layers,hls_bit_exact,1545.6,1.5455999999999999,646997.9296066253,5175983.436853003,355.1138716356108,True,0.0,success,,68,20,8,7,30,0,7,24,8,21,1,True,True,/home/a.gnaneswaran/fpl26/aie4ml/experiments/runs/models/vae_lhc_large/cand_05_cols_26_wl_512_L0_PK_4_PN_4_L1_PK_8_PN_2_L2_PK_2_PN_1_L3_PK_1_PN_2_L4_PK_2_PN_8_L5_PK_4_PN_4
vae_lhc_large,9,cand_09_cols_24_wl_512_L0_PK_4_PN_4_L1_PK_4_PN_4_L2_PK_2_PN_1_L3_PK_1_PN_2_L4_PK_4_PN_4_L5_PK_4_PN_4,6,8,64,64,64x128|128x64|64x12|12x64|64x128|128x64,4x4|4x4|2x1|1x2|4x4|4x4,4,8,8,32,31,24,7,4,19,68,512,0,512,no_batchnorm_layers,hls_bit_exact,1471.2,1.4712,679717.2376291462,5437737.90103317,373.0723219140837,True,0.0,success,,68,18,4,7,28,0,3,22,4,19,1,True,True,/home/a.gnaneswaran/fpl26/aie4ml/experiments/runs/models/vae_lhc_large/cand_09_cols_24_wl_512_L0_PK_4_PN_4_L1_PK_4_PN_4_L2_PK_2_PN_1_L3_PK_1_PN_2_L4_PK_4_PN_4_L5_PK_4_PN_4
vae_lhc_large,12,cand_12_cols_22_wl_512_L0_PK_4_PN_4_L1_PK_4_PN_4_L2_PK_2_PN_1_L3_PK_1_PN_2_L4_PK_2_PN_8_L5_PK_4_PN_4,6,8,64,64,64x128|128x64|64x12|12x64|64x128|128x64,4x4|4x4|2x1|1x2|2x8|4x4,4,8,8,32,31,22,9,8,17,68,512,0,512,no_batchnorm_layers,hls_bit_exact,1500.8,1.5008,666311.3006396588,5330490.405117271,365.7142857142857,True,0.0,success,,68,16,8,7,26,0,7,20,8,23,1,True,True,/home/a.gnaneswaran/fpl26/aie4ml/experiments/runs/models/vae_lhc_large/cand_12_cols_22_wl_512_L0_PK_4_PN_4_L1_PK_4_PN_4_L2_PK_2_PN_1_L3_PK_1_PN_2_L4_PK_2_PN_8_L5_PK_4_PN_4
vae_lhc_large,14,cand_14_cols_20_wl_512_L0_PK_2_PN_8_L1_PK_4_PN_4_L2_PK_2_PN_1_L3_PK_1_PN_2_L4_PK_2_PN_8_L5_PK_4_PN_4,6,8,64,64,64x128|128x64|64x12|12x64|64x128|128x64,2x8|4x4|2x1|1x2|2x8|4x4,4,8,8,32,31,20,11,8,15,68,512,0,512,no_batchnorm_layers,hls_bit_exact,1545.6,1.5455999999999999,646997.9296066253,5175983.436853003,355.1138716356108,True,0.0,success,,68,14,8,7,24,0,7,18,8,27,1,True,True,/home/a.gnaneswaran/fpl26/aie4ml/experiments/runs/models/vae_lhc_large/cand_14_cols_20_wl_512_L0_PK_2_PN_8_L1_PK_4_PN_4_L2_PK_2_PN_1_L3_PK_1_PN_2_L4_PK_2_PN_8_L5_PK_4_PN_4
vae_lhc_large,15,cand_15_cols_30_wl_512_L0_PK_4_PN_4_L1_PK_8_PN_2_L2_PK_4_PN_1_L3_PK_1_PN_2_L4_PK_4_PN_4_L5_PK_4_PN_4,6,8,64,64,64x128|128x64|64x12|12x64|64x128|128x64,4x4|8x2|4x1|1x2|4x4|4x4,4,8,8,32,31,30,1,4,25,70,512,256,512,no_batchnorm_layers,hls_bit_exact,1500.8,1.5008,666311.3006396588,5330490.405117271,365.7142857142857,True,0.0,success,,70,23,4,7,32,0,3,26,4,17,1,True,True,/home/a.gnaneswaran/fpl26/aie4ml/experiments/runs/models/vae_lhc_large/cand_15_cols_30_wl_512_L0_PK_4_PN_4_L1_PK_8_PN_2_L2_PK_4_PN_1_L3_PK_1_PN_2_L4_PK_4_PN_4_L5_PK_4_PN_4
vae_lhc_large,17,cand_17_cols_30_wl_512_L0_PK_4_PN_4_L1_PK_8_PN_2_L2_PK_2_PN_1_L3_PK_1_PN_2_L4_PK_2_PN_8_L5_PK_8_PN_4,6,8,64,64,64x128|128x64|64x12|12x64|64x128|128x64,4x4|8x2|2x1|1x2|2x8|8x4,4,8,8,32,31,30,1,8,25,84,512,256,512,no_batchnorm_layers,hls_bit_exact,1540.0,1.54,649350.6493506493,5194805.194805195,356.4051948051948,True,0.0,success,,84,24,8,7,34,0,7,28,8,21,1,True,True,/home/a.gnaneswaran/fpl26/aie4ml/experiments/runs/models/vae_lhc_large/cand_17_cols_30_wl_512_L0_PK_4_PN_4_L1_PK_8_PN_2_L2_PK_2_PN_1_L3_PK_1_PN_2_L4_PK_2_PN_8_L5_PK_8_PN_4
vae_lhc_large,71,cand_71_cols_30_wl_512_L0_PK_4_PN_4_L1_PK_4_PN_4_L2_PK_4_PN_1_L3_PK_1_PN_2_L4_PK_4_PN_4_L5_PK_8_PN_4,6,8,64,64,64x128|128x64|64x12|12x64|64x128|128x64,4x4|4x4|4x1|1x2|4x4|8x4,4,8,8,32,31,30,1,4,25,86,512,512,512,no_batchnorm_layers,hls_bit_exact,1467.2,1.4672,681570.3380588876,5452562.704471101,374.08942202835334,True,0.0,success,,86,23,5,7,32,0,4,26,5,19,1,True,True,/home/a.gnaneswaran/fpl26/aie4ml/experiments/runs/models/vae_lhc_large/cand_71_cols_30_wl_512_L0_PK_4_PN_4_L1_PK_4_PN_4_L2_PK_4_PN_1_L3_PK_1_PN_2_L4_PK_4_PN_4_L5_PK_8_PN_4
vae_lhc_large,73,cand_73_cols_30_wl_512_L0_PK_4_PN_4_L1_PK_8_PN_2_L2_PK_4_PN_1_L3_PK_1_PN_4_L4_PK_4_PN_4_L5_PK_4_PN_4,6,8,64,64,64x128|128x64|64x12|12x64|64x128|128x64,4x4|8x2|4x1|1x4|4x4|4x4,4,8,8,32,31,30,1,4,25,72,512,512,512,no_batchnorm_layers,hls_bit_exact,1456.8,1.4567999999999999,686436.0241625481,5491488.193300385,376.7600219659528,True,0.0,success,,72,23,5,7,32,0,4,26,5,19,1,True,True,/home/a.gnaneswaran/fpl26/aie4ml/experiments/runs/models/vae_lhc_large/cand_73_cols_30_wl_512_L0_PK_4_PN_4_L1_PK_8_PN_2_L2_PK_4_PN_1_L3_PK_1_PN_4_L4_PK_4_PN_4_L5_PK_4_PN_4
vae_lhc_large,75,cand_75_cols_30_wl_512_L0_PK_2_PN_8_L1_PK_8_PN_2_L2_PK_2_PN_1_L3_PK_1_PN_2_L4_PK_4_PN_8_L5_PK_8_PN_4,6,8,64,64,64x128|128x64|64x12|12x64|64x128|128x64,2x8|8x2|2x1|1x2|4x8|8x4,4,8,8,32,31,30,1,8,25,100,512,512,512,no_batchnorm_layers,hls_bit_exact,1559.2,1.5592000000000001,641354.5407901488,5130836.32632119,352.0164186762442,True,0.0,success,,100,24,8,7,34,0,7,28,8,25,1,True,True,/home/a.gnaneswaran/fpl26/aie4ml/experiments/runs/models/vae_lhc_large/cand_75_cols_30_wl_512_L0_PK_2_PN_8_L1_PK_8_PN_2_L2_PK_2_PN_1_L3_PK_1_PN_2_L4_PK_4_PN_8_L5_PK_8_PN_4
vae_lhc_large,152,cand_152_cols_30_wl_512_L0_PK_4_PN_4_L1_PK_4_PN_4_L2_PK_4_PN_1_L3_PK_1_PN_4_L4_PK_4_PN_4_L5_PK_8_PN_4,6,8,64,64,64x128|128x64|64x12|12x64|64x128|128x64,4x4|4x4|4x1|1x4|4x4|8x4,4,8,8,32,31,30,1,4,25,88,512,768,512,no_batchnorm_layers,hls_bit_exact,1450.4,1.4504000000000001,689464.9751792608,5515719.801434087,378.4225041367898,True,0.0,success,,88,23,5,7,32,0,4,26,5,21,1,True,True,/home/a.gnaneswaran/fpl26/aie4ml/experiments/runs/models/vae_lhc_large/cand_152_cols_30_wl_512_L0_PK_4_PN_4_L1_PK_4_PN_4_L2_PK_4_PN_1_L3_PK_1_PN_4_L4_PK_4_PN_4_L5_PK_8_PN_4
multi_qubit_readout_discriminator,0,cand_00_cols_28_wl_512_L0_PK_8_PN_8_L1_PK_4_PN_8_L2_PK_4_PN_8_L3_PK_4_PN_8_L4_PK_4_PN_1,5,8,256,8,256x128|128x128|128x128|128x128|128x8,8x8|4x8|4x8|4x8|4x1,4,8,8,32,31,28,3,8,24,164,512,0,1024,no_batchnorm_layers,hls_bit_exact,1699.2,1.6992,588512.241054614,4708097.928436912,781.0169491525423,True,0.0,success,,164,24,8,7,34,0,7,28,8,33,1,True,True,/home/a.gnaneswaran/fpl26/aie4ml/experiments/runs/models/multi_qubit_readout_discriminator/cand_00_cols_28_wl_512_L0_PK_8_PN_8_L1_PK_4_PN_8_L2_PK_4_PN_8_L3_PK_4_PN_8_L4_PK_4_PN_1
multi_qubit_readout_discriminator,1,cand_01_cols_30_wl_1024_L0_PK_8_PN_4_L1_PK_8_PN_2_L2_PK_4_PN_4_L3_PK_4_PN_4_L4_PK_2_PN_1,5,8,256,8,256x128|128x128|128x128|128x128|128x8,8x4|8x2|4x4|4x4|2x1,4,8,8,32,31,30,1,4,26,82,1024,0,1024,no_batchnorm_layers,hls_bit_exact,1847.2,1.8472,541359.8960588999,4330879.168471199,718.4408834993503,True,0.0,success,,82,25,5,7,34,0,4,28,5,15,1,True,True,/home/a.gnaneswaran/fpl26/aie4ml/experiments/runs/models/multi_qubit_readout_discriminator/cand_01_cols_30_wl_1024_L0_PK_8_PN_4_L1_PK_8_PN_2_L2_PK_4_PN_4_L3_PK_4_PN_4_L4_PK_2_PN_1
multi_qubit_readout_discriminator,16,cand_16_cols_26_wl_1024_L0_PK_8_PN_4_L1_PK_4_PN_4_L2_PK_4_PN_4_L3_PK_4_PN_4_L4_PK_2_PN_1,5,8,256,8,256x128|128x128|128x128|128x128|128x8,8x4|4x4|4x4|4x4|2x1,4,8,8,32,31,26,5,4,22,82,1024,0,1024,no_batchnorm_layers,hls_bit_exact,1792.0,1.792,558035.7142857143,4464285.714285715,740.5714285714286,True,0.0,success,,82,21,5,7,30,0,4,24,5,17,1,True,True,/home/a.gnaneswaran/fpl26/aie4ml/experiments/runs/models/multi_qubit_readout_discriminator/cand_16_cols_26_wl_1024_L0_PK_8_PN_4_L1_PK_4_PN_4_L2_PK_4_PN_4_L3_PK_4_PN_4_L4_PK_2_PN_1
multi_qubit_readout_discriminator,23,cand_23_cols_24_wl_1024_L0_PK_8_PN_4_L1_PK_4_PN_4_L2_PK_4_PN_4_L3_PK_2_PN_8_L4_PK_2_PN_1,5,8,256,8,256x128|128x128|128x128|128x128|128x8,8x4|4x4|4x4|2x8|2x1,4,8,8,32,31,24,7,8,20,82,1024,0,1024,no_batchnorm_layers,hls_bit_exact,1798.4,1.7984,556049.8220640569,4448398.576512455,737.9359430604982,True,0.0,success,,82,20,8,7,30,0,7,24,8,21,1,True,True,/home/a.gnaneswaran/fpl26/aie4ml/experiments/runs/models/multi_qubit_readout_discriminator/cand_23_cols_24_wl_1024_L0_PK_8_PN_4_L1_PK_4_PN_4_L2_PK_4_PN_4_L3_PK_2_PN_8_L4_PK_2_PN_1
multi_qubit_readout_discriminator,32,cand_32_cols_22_wl_1024_L0_PK_8_PN_4_L1_PK_4_PN_4_L2_PK_2_PN_8_L3_PK_2_PN_8_L4_PK_2_PN_1,5,8,256,8,256x128|128x128|128x128|128x128|128x8,8x4|4x4|2x8|2x8|2x1,4,8,8,32,31,22,9,8,18,82,1024,0,1024,no_batchnorm_layers,hls_bit_exact,1830.4,1.8304,546328.6713286713,4370629.37062937,725.034965034965,True,0.0,success,,82,18,8,7,28,0,7,22,8,25,1,True,True,/home/a.gnaneswaran/fpl26/aie4ml/experiments/runs/models/multi_qubit_readout_discriminator/cand_32_cols_22_wl_1024_L0_PK_8_PN_4_L1_PK_4_PN_4_L2_PK_2_PN_8_L3_PK_2_PN_8_L4_PK_2_PN_1
multi_qubit_readout_discriminator,39,cand_39_cols_20_wl_1024_L0_PK_8_PN_4_L1_PK_2_PN_8_L2_PK_2_PN_8_L3_PK_2_PN_8_L4_PK_2_PN_1,5,8,256,8,256x128|128x128|128x128|128x128|128x8,8x4|2x8|2x8|2x8|2x1,4,8,8,32,31,20,11,8,16,82,1024,0,1024,no_batchnorm_layers,hls_bit_exact,1843.2,1.8432,542534.7222222222,4340277.777777778,720.0,True,0.0,success,,82,16,8,7,26,0,7,20,8,29,1,True,True,/home/a.gnaneswaran/fpl26/aie4ml/experiments/runs/models/multi_qubit_readout_discriminator/cand_39_cols_20_wl_1024_L0_PK_8_PN_4_L1_PK_2_PN_8_L2_PK_2_PN_8_L3_PK_2_PN_8_L4_PK_2_PN_1
multi_qubit_readout_discriminator,43,cand_43_cols_18_wl_1024_L0_PK_4_PN_8_L1_PK_4_PN_4_L2_PK_2_PN_8_L3_PK_2_PN_8_L4_PK_2_PN_1,5,8,256,8,256x128|128x128|128x128|128x128|128x8,4x8|4x4|2x8|2x8|2x1,4,8,8,32,31,18,13,8,14,82,1024,0,1024,no_batchnorm_layers,hls_bit_exact,1849.6,1.8496,540657.4394463669,4325259.515570935,717.5086505190312,True,0.0,success,,82,14,8,7,24,0,7,18,8,29,1,True,True,/home/a.gnaneswaran/fpl26/aie4ml/experiments/runs/models/multi_qubit_readout_discriminator/cand_43_cols_18_wl_1024_L0_PK_4_PN_8_L1_PK_4_PN_4_L2_PK_2_PN_8_L3_PK_2_PN_8_L4_PK_2_PN_1
multi_qubit_readout_discriminator,46,cand_46_cols_16_wl_1024_L0_PK_4_PN_8_L1_PK_2_PN_8_L2_PK_2_PN_8_L3_PK_2_PN_8_L4_PK_2_PN_1,5,8,256,8,256x128|128x128|128x128|128x128|128x8,4x8|2x8|2x8|2x8|2x1,4,8,8,32,31,16,15,8,12,82,1024,0,1024,no_batchnorm_layers,hls_bit_exact,1848.0,1.848,541125.5411255411,4329004.329004329,718.1298701298701,True,0.0,success,,82,12,8,7,22,0,7,16,8,33,1,True,True,/home/a.gnaneswaran/fpl26/aie4ml/experiments/runs/models/multi_qubit_readout_discriminator/cand_46_cols_16_wl_1024_L0_PK_4_PN_8_L1_PK_2_PN_8_L2_PK_2_PN_8_L3_PK_2_PN_8_L4_PK_2_PN_1
multi_qubit_readout_discriminator,47,cand_47_cols_30_wl_1024_L0_PK_8_PN_4_L1_PK_4_PN_4_L2_PK_4_PN_4_L3_PK_8_PN_3_L4_PK_2_PN_1,5,8,256,8,256x128|128x128|128x128|128x128|128x8,8x4|4x4|4x4|8x3|2x1,4,8,8,32,31,30,1,4,26,90,1024,256,3072,no_batchnorm_layers,hls_bit_exact,1803.2,1.8032000000000001,554569.6539485359,4436557.231588287,735.9716060337178,True,0.0,success,,90,25,4,7,34,0,3,28,4,16,1,True,True,/home/a.gnaneswaran/fpl26/aie4ml/experiments/runs/models/multi_qubit_readout_discriminator/cand_47_cols_30_wl_1024_L0_PK_8_PN_4_L1_PK_4_PN_4_L2_PK_4_PN_4_L3_PK_8_PN_3_L4_PK_2_PN_1
multi_qubit_readout_discriminator,83,cand_83_cols_30_wl_1024_L0_PK_8_PN_4_L1_PK_4_PN_4_L2_PK_4_PN_4_L3_PK_8_PN_4_L4_PK_2_PN_1,5,8,256,8,256x128|128x128|128x128|128x128|128x8,8x4|4x4|4x4|8x4|2x1,4,8,8,32,31,30,1,4,26,98,1024,512,1024,no_batchnorm_layers,hls_bit_exact,1772.0,1.772,564334.0857787811,4514672.686230249,748.9300225733634,True,0.0,success,,98,25,5,7,34,0,4,28,5,17,1,True,True,/home/a.gnaneswaran/fpl26/aie4ml/experiments/runs/models/multi_qubit_readout_discriminator/cand_83_cols_30_wl_1024_L0_PK_8_PN_4_L1_PK_4_PN_4_L2_PK_4_PN_4_L3_PK_8_PN_4_L4_PK_2_PN_1
multi_qubit_readout_discriminator,86,cand_86_cols_30_wl_1024_L0_PK_8_PN_8_L1_PK_8_PN_2_L2_PK_4_PN_4_L3_PK_4_PN_4_L4_PK_2_PN_1,5,8,256,8,256x128|128x128|128x128|128x128|128x8,8x8|8x2|4x4|4x4|2x1,4,8,8,32,31,30,1,8,26,114,1024,512,1024,no_batchnorm_layers,hls_bit_exact,1819.2,1.8192000000000002,549692.1723834652,4397537.379067722,729.4986807387862,True,0.0,success,,114,25,8,7,34,0,7,28,8,19,1,True,True,/home/a.gnaneswaran/fpl26/aie4ml/experiments/runs/models/multi_qubit_readout_discriminator/cand_86_cols_30_wl_1024_L0_PK_8_PN_8_L1_PK_8_PN_2_L2_PK_4_PN_4_L3_PK_4_PN_4_L4_PK_2_PN_1
multi_qubit_readout_discriminator,104,cand_104_cols_30_wl_1024_L0_PK_8_PN_4_L1_PK_8_PN_2_L2_PK_4_PN_4_L3_PK_2_PN_8_L4_PK_4_PN_1,5,8,256,8,256x128|128x128|128x128|128x128|128x8,8x4|8x2|4x4|2x8|4x1,4,8,8,32,31,30,1,8,26,84,1024,512,1024,no_batchnorm_layers,hls_bit_exact,1808.0,1.808,553097.3451327434,4424778.761061947,734.0176991150443,True,0.0,success,,84,26,8,7,36,0,7,30,8,19,1,True,True,/home/a.gnaneswaran/fpl26/aie4ml/experiments/runs/models/multi_qubit_readout_discriminator/cand_104_cols_30_wl_1024_L0_PK_8_PN_4_L1_PK_8_PN_2_L2_PK_4_PN_4_L3_PK_2_PN_8_L4_PK_4_PN_1
deep_autoencoder,0,cand_00_cols_29_wl_1024_L0_PK_4_PN_4_L1_PK_4_PN_4_L2_PK_2_PN_8_L3_PK_2_PN_8_L4_PK_2_PN_1_L5_PK_1_PN_2_L6_PK_2_PN_8_L7_PK_2_PN_8_L8_PK_2_PN_8,9,8,128,128,128x128|128x128|128x128|128x128|128x8|8x128|128x128|128x128|128x128,4x4|4x4|2x8|2x8|2x1|1x2|2x8|2x8|2x8,4,8,8,32,31,29,2,8,21,116,1024,0,2048,no_batchnorm_layers,hls_bit_exact,3024.0,3.024,330687.8306878307,2645502.6455026455,617.6507936507936,True,0.0,success,,116,20,8,7,33,0,7,27,8,51,1,True,True,/home/a.gnaneswaran/fpl26/aie4ml/experiments/runs/models/deep_autoencoder/cand_00_cols_29_wl_1024_L0_PK_4_PN_4_L1_PK_4_PN_4_L2_PK_2_PN_8_L3_PK_2_PN_8_L4_PK_2_PN_1_L5_PK_1_PN_2_L6_PK_2_PN_8_L7_PK_2_PN_8_L8_PK_2_PN_8
deep_autoencoder,21,cand_21_cols_27_wl_1024_L0_PK_4_PN_4_L1_PK_2_PN_8_L2_PK_2_PN_8_L3_PK_2_PN_8_L4_PK_2_PN_1_L5_PK_1_PN_2_L6_PK_2_PN_8_L7_PK_2_PN_8_L8_PK_2_PN_8,9,8,128,128,128x128|128x128|128x128|128x128|128x8|8x128|128x128|128x128|128x128,4x4|2x8|2x8|2x8|2x1|1x2|2x8|2x8|2x8,4,8,8,32,31,27,4,8,19,116,1024,0,2048,no_batchnorm_layers,hls_bit_exact,3052.8,3.0528000000000004,327568.13417190773,2620545.073375262,611.8238993710692,True,0.0,success,,116,18,8,7,31,0,7,25,8,55,1,True,True,/home/a.gnaneswaran/fpl26/aie4ml/experiments/runs/models/deep_autoencoder/cand_21_cols_27_wl_1024_L0_PK_4_PN_4_L1_PK_2_PN_8_L2_PK_2_PN_8_L3_PK_2_PN_8_L4_PK_2_PN_1_L5_PK_1_PN_2_L6_PK_2_PN_8_L7_PK_2_PN_8_L8_PK_2_PN_8
deep_autoencoder,28,cand_28_cols_25_wl_1024_L0_PK_2_PN_8_L1_PK_2_PN_8_L2_PK_2_PN_8_L3_PK_2_PN_8_L4_PK_2_PN_1_L5_PK_1_PN_2_L6_PK_2_PN_8_L7_PK_2_PN_8_L8_PK_2_PN_8,9,8,128,128,128x128|128x128|128x128|128x128|128x8|8x128|128x128|128x128|128x128,2x8|2x8|2x8|2x8|2x1|1x2|2x8|2x8|2x8,4,8,8,32,31,25,6,8,17,116,1024,0,2048,no_batchnorm_layers,hls_bit_exact,3110.4,3.1104000000000003,321502.0576131687,2572016.46090535,600.4938271604938,True,0.0,success,,116,16,8,7,29,0,7,23,8,59,1,True,True,/home/a.gnaneswaran/fpl26/aie4ml/experiments/runs/models/deep_autoencoder/cand_28_cols_25_wl_1024_L0_PK_2_PN_8_L1_PK_2_PN_8_L2_PK_2_PN_8_L3_PK_2_PN_8_L4_PK_2_PN_1_L5_PK_1_PN_2_L6_PK_2_PN_8_L7_PK_2_PN_8_L8_PK_2_PN_8
deep_autoencoder,29,cand_29_cols_31_wl_1024_L0_PK_4_PN_4_L1_PK_4_PN_4_L2_PK_4_PN_4_L3_PK_2_PN_8_L4_PK_2_PN_1_L5_PK_1_PN_2_L6_PK_2_PN_8_L7_PK_2_PN_8_L8_PK_2_PN_8,9,8,128,128,128x128|128x128|128x128|128x128|128x8|8x128|128x128|128x128|128x128,4x4|4x4|4x4|2x8|2x1|1x2|2x8|2x8|2x8,4,8,8,32,31,31,0,8,23,116,1024,0,2048,no_batchnorm_layers,hls_bit_exact,nan,nan,nan,nan,nan,False,nan,failed,"(WARNING:2, CRITICAL-WARNING:0, ERROR:1)",nan,nan,nan,nan,nan,nan,nan,nan,nan,nan,nan,False,False,/home/a.gnaneswaran/fpl26/aie4ml/experiments/runs/models/deep_autoencoder/cand_29_cols_31_wl_1024_L0_PK_4_PN_4_L1_PK_4_PN_4_L2_PK_4_PN_4_L3_PK_2_PN_8_L4_PK_2_PN_1_L5_PK_1_PN_2_L6_PK_2_PN_8_L7_PK_2_PN_8_L8_PK_2_PN_8
deep_autoencoder,71,cand_71_cols_29_wl_1024_L0_PK_4_PN_4_L1_PK_4_PN_4_L2_PK_2_PN_8_L3_PK_2_PN_8_L4_PK_2_PN_1_L5_PK_1_PN_3_L6_PK_2_PN_8_L7_PK_2_PN_8_L8_PK_2_PN_8,9,8,128,128,128x128|128x128|128x128|128x128|128x8|8x128|128x128|128x128|128x128,4x4|4x4|2x8|2x8|2x1|1x3|2x8|2x8|2x8,4,8,8,32,31,29,2,8,21,117,1024,256,2304,no_batchnorm_layers,hls_bit_exact,2979.2,2.9791999999999996,335660.5800214823,2685284.6401718585,626.9387755102041,True,0.0,success,,117,20,8,7,33,0,7,27,8,52,1,True,True,/home/a.gnaneswaran/fpl26/aie4ml/experiments/runs/models/deep_autoencoder/cand_71_cols_29_wl_1024_L0_PK_4_PN_4_L1_PK_4_PN_4_L2_PK_2_PN_8_L3_PK_2_PN_8_L4_PK_2_PN_1_L5_PK_1_PN_3_L6_PK_2_PN_8_L7_PK_2_PN_8_L8_PK_2_PN_8
deep_autoencoder,142,cand_142_cols_31_wl_1024_L0_PK_2_PN_8_L1_PK_2_PN_8_L2_PK_2_PN_8_L3_PK_2_PN_8_L4_PK_2_PN_1_L5_PK_1_PN_2_L6_PK_2_PN_8_L7_PK_2_PN_8_L8_PK_8_PN_3,9,8,128,128,128x128|128x128|128x128|128x128|128x8|8x128|128x128|128x128|128x128,2x8|2x8|2x8|2x8|2x1|1x2|2x8|2x8|8x3,4,8,8,32,31,31,0,8,23,124,1024,256,4096,no_batchnorm_layers,hls_bit_exact,nan,nan,nan,nan,nan,False,nan,failed,"(WARNING:2, CRITICAL-WARNING:0, ERROR:1)",nan,nan,nan,nan,nan,nan,nan,nan,nan,nan,nan,False,False,/home/a.gnaneswaran/fpl26/aie4ml/experiments/runs/models/deep_autoencoder/cand_142_cols_31_wl_1024_L0_PK_2_PN_8_L1_PK_2_PN_8_L2_PK_2_PN_8_L3_PK_2_PN_8_L4_PK_2_PN_1_L5_PK_1_PN_2_L6_PK_2_PN_8_L7_PK_2_PN_8_L8_PK_8_PN_3
deep_autoencoder,149,cand_149_cols_29_wl_1024_L0_PK_4_PN_4_L1_PK_2_PN_8_L2_PK_2_PN_8_L3_PK_2_PN_8_L4_PK_2_PN_1_L5_PK_1_PN_2_L6_PK_2_PN_8_L7_PK_2_PN_8_L8_PK_4_PN_8,9,8,128,128,128x128|128x128|128x128|128x128|128x8|8x128|128x128|128x128|128x128,4x4|2x8|2x8|2x8|2x1|1x2|2x8|2x8|4x8,4,8,8,32,31,29,2,8,21,132,1024,512,2048,no_batchnorm_layers,hls_bit_exact,nan,nan,nan,nan,nan,False,nan,failed,"(WARNING:2, CRITICAL-WARNING:0, ERROR:1)",nan,nan,nan,nan,nan,nan,nan,nan,nan,nan,nan,False,False,/home/a.gnaneswaran/fpl26/aie4ml/experiments/runs/models/deep_autoencoder/cand_149_cols_29_wl_1024_L0_PK_4_PN_4_L1_PK_2_PN_8_L2_PK_2_PN_8_L3_PK_2_PN_8_L4_PK_2_PN_1_L5_PK_1_PN_2_L6_PK_2_PN_8_L7_PK_2_PN_8_L8_PK_4_PN_8
deep_autoencoder,214,cand_214_cols_31_wl_1024_L0_PK_2_PN_8_L1_PK_2_PN_8_L2_PK_2_PN_8_L3_PK_2_PN_8_L4_PK_2_PN_1_L5_PK_1_PN_3_L6_PK_2_PN_8_L7_PK_2_PN_8_L8_PK_8_PN_3,9,8,128,128,128x128|128x128|128x128|128x128|128x8|8x128|128x128|128x128|128x128,2x8|2x8|2x8|2x8|2x1|1x3|2x8|2x8|8x3,4,8,8,32,31,31,0,8,23,125,1024,512,4352,no_batchnorm_layers,hls_bit_exact,nan,nan,nan,nan,nan,False,nan,failed,"(WARNING:2, CRITICAL-WARNING:0, ERROR:1)",nan,nan,nan,nan,nan,nan,nan,nan,nan,nan,nan,False,False,/home/a.gnaneswaran/fpl26/aie4ml/experiments/runs/models/deep_autoencoder/cand_214_cols_31_wl_1024_L0_PK_2_PN_8_L1_PK_2_PN_8_L2_PK_2_PN_8_L3_PK_2_PN_8_L4_PK_2_PN_1_L5_PK_1_PN_3_L6_PK_2_PN_8_L7_PK_2_PN_8_L8_PK_8_PN_3
deep_autoencoder,216,cand_216_cols_29_wl_1024_L0_PK_4_PN_4_L1_PK_2_PN_8_L2_PK_2_PN_8_L3_PK_2_PN_8_L4_PK_2_PN_1_L5_PK_1_PN_3_L6_PK_2_PN_8_L7_PK_2_PN_8_L8_PK_4_PN_8,9,8,128,128,128x128|128x128|128x128|128x128|128x8|8x128|128x128|128x128|128x128,4x4|2x8|2x8|2x8|2x1|1x3|2x8|2x8|4x8,4,8,8,32,31,29,2,8,21,133,1024,768,2304,no_batchnorm_layers,hls_bit_exact,nan,nan,nan,nan,nan,False,nan,failed,"(WARNING:2, CRITICAL-WARNING:0, ERROR:1)",nan,nan,nan,nan,nan,nan,nan,nan,nan,nan,nan,False,False,/home/a.gnaneswaran/fpl26/aie4ml/experiments/runs/models/deep_autoencoder/cand_216_cols_29_wl_1024_L0_PK_4_PN_4_L1_PK_2_PN_8_L2_PK_2_PN_8_L3_PK_2_PN_8_L4_PK_2_PN_1_L5_PK_1_PN_3_L6_PK_2_PN_8_L7_PK_2_PN_8_L8_PK_4_PN_8
deep_autoencoder,230,cand_230_cols_31_wl_1024_L0_PK_2_PN_8_L1_PK_2_PN_8_L2_PK_2_PN_8_L3_PK_2_PN_8_L4_PK_2_PN_1_L5_PK_1_PN_2_L6_PK_2_PN_8_L7_PK_2_PN_8_L8_PK_8_PN_8,9,8,128,128,128x128|128x128|128x128|128x128|128x8|8x128|128x128|128x128|128x128,2x8|2x8|2x8|2x8|2x1|1x2|2x8|2x8|8x8,4,8,8,32,31,31,0,8,23,164,1024,768,2048,no_batchnorm_layers,hls_bit_exact,nan,nan,nan,nan,nan,False,nan,failed,"(WARNING:2, CRITICAL-WARNING:0, ERROR:1)",nan,nan,nan,nan,nan,nan,nan,nan,nan,nan,nan,False,False,/home/a.gnaneswaran/fpl26/aie4ml/experiments/runs/models/deep_autoencoder/cand_230_cols_31_wl_1024_L0_PK_2_PN_8_L1_PK_2_PN_8_L2_PK_2_PN_8_L3_PK_2_PN_8_L4_PK_2_PN_1_L5_PK_1_PN_2_L6_PK_2_PN_8_L7_PK_2_PN_8_L8_PK_8_PN_8
deep_autoencoder,1,cand_01_cols_29_wl_1024_L0_PK_4_PN_4_L1_PK_2_PN_8_L2_PK_4_PN_4_L3_PK_2_PN_8_L4_PK_2_PN_1_L5_PK_1_PN_2_L6_PK_2_PN_8_L7_PK_2_PN_8_L8_PK_2_PN_8,9,8,128,128,128x128|128x128|128x128|128x128|128x8|8x128|128x128|128x128|128x128,4x4|2x8|4x4|2x8|2x1|1x2|2x8|2x8|2x8,4,8,8,32,31,29,2,8,21,116,1024,0,2048,no_batchnorm_layers,hls_bit_exact,3004.8,3.0048000000000004,332800.85197018104,2662406.8157614483,621.5974440894569,True,0.0,success,,116,20,8,7,33,0,7,27,8,51,1,True,True,/home/a.gnaneswaran/fpl26/aie4ml/experiments/runs/models/deep_autoencoder/cand_01_cols_29_wl_1024_L0_PK_4_PN_4_L1_PK_2_PN_8_L2_PK_4_PN_4_L3_PK_2_PN_8_L4_PK_2_PN_1_L5_PK_1_PN_2_L6_PK_2_PN_8_L7_PK_2_PN_8_L8_PK_2_PN_8
deep_autoencoder,2,cand_02_cols_29_wl_1024_L0_PK_2_PN_8_L1_PK_4_PN_4_L2_PK_4_PN_4_L3_PK_2_PN_8_L4_PK_2_PN_1_L5_PK_1_PN_2_L6_PK_2_PN_8_L7_PK_2_PN_8_L8_PK_2_PN_8,9,8,128,128,128x128|128x128|128x128|128x128|128x8|8x128|128x128|128x128|128x128,2x8|4x4|4x4|2x8|2x1|1x2|2x8|2x8|2x8,4,8,8,32,31,29,2,8,21,116,1024,0,2048,no_batchnorm_layers,hls_bit_exact,3059.2,3.0591999999999997,326882.8451882845,2615062.761506276,610.5439330543934,True,0.0,success,,116,20,8,7,33,0,7,27,8,51,1,True,True,/home/a.gnaneswaran/fpl26/aie4ml/experiments/runs/models/deep_autoencoder/cand_02_cols_29_wl_1024_L0_PK_2_PN_8_L1_PK_4_PN_4_L2_PK_4_PN_4_L3_PK_2_PN_8_L4_PK_2_PN_1_L5_PK_1_PN_2_L6_PK_2_PN_8_L7_PK_2_PN_8_L8_PK_2_PN_8
